{
  "stateVersion": 3,
  "command": "rollout",
  "unit": "cabs",
  "patchId": "cabs-pr42",
  "params": {
    "percent": 10,
    "platforms": [
      "android",
      "ios"
    ]
  },
  "requester": "dev",
  "approver": "alice",
  "breakGlass": false,
  "ticket": "CAB-1",
  "pr": 42,
  "sourceSha": "bbbbbbbbbbbbbbbbbbbbbbbbbbbbbbbbbbbbbbbb",
  "jobUrl": "https://ci.example.com/job/ota-deploy/7",
  "ts": "2026-01-01T00:00:00.000Z",
  "previousVersion": 2,
  "prevAuditHash": "sha256:06df5f73241fc1c766e86c4931406bb0bb46cb910c95227f5421806dfa3e8e54"
}
