{
  "stateVersion": 1,
  "command": "init",
  "unit": null,
  "patchId": null,
  "params": {
    "releaseTag": "release/11.9.0"
  },
  "requester": "release-bot",
  "approver": null,
  "ticket": null,
  "pr": null,
  "sourceSha": null,
  "jobUrl": null,
  "ts": "2026-01-01T00:00:00.000Z",
  "previousVersion": null,
  "prevAuditHash": null
}
